ID,Main,Location,Corporation,Href,Date
0,IT Rendszeradminisztrátor,Bercel,NIDEC GPM HUNGARY Kft.,/allas/it_rendszeradminisztrator/RG-7041#adtype=dirOA,2023-02-13
1,.Net fejlesztő,Budapest,HVG Kiadó Zrt.,/allas/net_fejleszto/MO-6652#adtype=dirOA,2023-02-13
2,IT kontroller,Budapest,BKV Zrt.,/allas/it_kontroller/XQ-4102#adtype=dirCU,2023-02-13
3,FRANCIA NYELVŰ NEMZETKÖZI KAPCSOLATTARTÓ,Budapest,HumanField Kft.,/allas/francia_nyelvu_nemzetkozi_kapcsolattarto/VR-5906#adtype=indOA,2023-02-13
4,NÉMET NYELVŰ NEMZETKÖZI KAPCSOLATTARTÓ (16-2052),Budapest,HumanField Kft.,/allas/nemet_nyelvu_nemzetkozi_kapcsolattarto_16_2052/WA-5967#adtype=indOA,2023-02-13
5,PHP Developer,Budapest,NEMATECH Kft.,/allas/php_developer/IS-9847#adtype=dirOA,2023-02-13
6,SZOFTVER TÁMOGATÓ,Gödöllő,HumanField Kft.,/allas/szoftver_tamogato/SV-8474#adtype=indOA,2023-02-13
7,Szoftver Fejlesztő,Budapest,R-Szoft Kft.,/allas/szoftver_fejleszto/LA-4148#adtype=dirOA,2023-02-13
8,GYENGEÁRAMÚ HÁLÓZATTELEPITŐ,Budapest,Best Hunters Tanácsadó Iroda,/allas/gyengearamu_halozattelepito/HA-9138#adtype=indOA,2023-02-13
9,Ügyféltámogató informatikus,Budapest,ELTE Kancellária Emberi Erőforrás Igazgatóság,/allas/ugyfeltamogato_informatikus/TS-9605#adtype=dirOA,2023-02-13
10,Szoftver fejlesztő,Budapest,CompLOG MRC Kft.,/allas/szoftver_fejleszto/XG-7798#adtype=dirOA,2023-02-13
11,Rendszergazda - Rendszerüzemeltető,Győr,Uninet Stúdió Kft.,/allas/rendszergazda_rendszeruzemelteto/BA-2804#adtype=dirOA,2023-02-13
12,IT support,Budapest,CompLOG MRC Kft.,/allas/it_support/UC-6213#adtype=dirOA,2023-02-13
13,Automation Tester (REF1033G),Budapest,Deutsche Telekom IT Solutions,/allas/automation_tester_ref1033g/PM-6831#adtype=dirCU,2023-02-13
14,Senior Security Consultant (REF1365Q),Budapest,Deutsche Telekom IT Solutions,/allas/senior_security_consultant_ref1365q/LB-7358#adtype=dirCU,2023-02-13
15,Cloud Application Operation,Budapest,Deutsche Telekom IT Solutions,/allas/cloud_application_operation/BT-5755#adtype=dirCU,2023-02-13
16,Software Safety Engineer,Budapest,Thyssenkrupp,/allas/software_safety_engineer/CH-9990#adtype=dirCU,2023-02-13
17,Python Developer (REF260N),Debrecen,Deutsche Telekom IT Solutions,/allas/python_developer_ref260n/ML-7772#adtype=dirCU,2023-02-13
18,Developer (REF1307I),Budapest,Deutsche Telekom IT Solutions,/allas/developer_ref1307i/GK-8222#adtype=dirCU,2023-02-13
19,Tapasztalt Frontend Fejlesztő (REF155V),Budapest,Deutsche Telekom IT Solutions,/allas/tapasztalt_frontend_fejleszto_ref155v/WT-4527#adtype=dirCU,2023-02-13
20,People Lead - Devops (REF1105J),Budapest,Deutsche Telekom IT Solutions,/allas/people_lead_devops_ref1105j/YL-9534#adtype=dirCU,2023-02-13
21,AWS Data Architect - REF339V,Budapest,Deutsche Telekom IT Solutions,/allas/aws_data_architect_ref339v/SB-6335#adtype=dirCU,2023-02-13
22,DevOps Engineer ARD (TECHNIK HU/ VNI) (REF217J),Budapest,Deutsche Telekom IT Solutions,/allas/devops_engineer_ard_technik_hu_vni_ref217j/AC-0067#adtype=dirCU,2023-02-13
23,Operation Manager Agile (PowerPlatform) (REF1408G),Budapest,Deutsche Telekom IT Solutions,/allas/operation_manager_agile_powerplatform_ref1408g/YL-1464#adtype=dirCU,2023-02-13
24,Head of Team (Open Telekom Cloud) - REF1229O,Budapest,Deutsche Telekom IT Solutions,/allas/head_of_team_open_telekom_cloud_ref1229o/OB-6606#adtype=dirCU,2023-02-13
25,GCP (Google Cloud Platform) Consultant - REF142Z,Budapest,Deutsche Telekom IT Solutions,/allas/gcp_google_cloud_platform_consultant_ref142z/RR-2987#adtype=dirCU,2023-02-13
26,Incident responder (cert) ref68o,Budapest,Deutsche Telekom IT Solutions,/allas/incident_responder_cert_ref68o/QB-4952#adtype=dirCU,2023-02-13
27,Software engineer team lead,Budapest,Randstad Hungary Kft,/allas/software_engineer_team_lead/IG-8638#adtype=indCU,2023-02-13
28,BSS Tester (REF1034E),Budapest,Deutsche Telekom IT Solutions,/allas/bss_tester_ref1034e/JI-8435#adtype=dirCU,2023-02-13
29,Senior Software Engineer,Budapest,Thyssenkrupp,/allas/senior_software_engineer/FY-2042#adtype=dirCU,2023-02-13
30,Security Analyst (REF92A),Budapest,Deutsche Telekom IT Solutions,/allas/security_analyst_ref92a/IP-7970#adtype=dirCU,2023-02-13
31,"Management Support Consultant - Business Area, Private Cloud & Platform Services (m/w/d) (REF1439H)",Budapest,Deutsche Telekom IT Solutions,/allas/management_support_consultant_business_area_private_cloud_platform_services_mwd_ref1439h/RA-0946#adtype=dirCU,2023-02-13
32,Medior Backend fejlesztő német nyelvtudással (REF954Z),Budapest,Deutsche Telekom IT Solutions,/allas/medior_backend_fejleszto_nemet_nyelvtudassal_ref954z/BY-7611#adtype=dirCU,2023-02-13
33,Experienced IT Architect for Software Engineering (REF1435M),Budapest,Deutsche Telekom IT Solutions,/allas/experienced_it_architect_for_software_engineering_ref1435m/SX-2550#adtype=dirCU,2023-02-13
34,Szabályozástechnikai mérnök - Kutatás és előfejlesztés,Budapest,Thyssenkrupp,/allas/szabalyozastechnikai_mernok_kutatas_es_elofejlesztes/OM-3044#adtype=dirCU,2023-02-13
35,Szoftver projektvezető,Budapest,Thyssenkrupp,/allas/szoftver_projektvezeto/AC-4992#adtype=dirCU,2023-02-13
36,Applikációs funkciófejlesztő mérnök (MATLAB/Simulink),Budapest,Thyssenkrupp,/allas/applikacios_funkciofejleszto_mernok_matlabsimulink/XD-6392#adtype=dirCU,2023-02-13
37,Tapasztalt tesztelő német nyelvtudással (REF126D),Budapest,Deutsche Telekom IT Solutions,/allas/tapasztalt_tesztelo_nemet_nyelvtudassal_ref126d/DA-9574#adtype=dirCU,2023-02-13
38,Operation Manager (OPM) (REF902W),Budapest,Deutsche Telekom IT Solutions,/allas/operation_manager_opm_ref902w/ZZ-0953#adtype=dirCU,2023-02-13
39,Rendszerintegrációs mérnök,Budapest,Thyssenkrupp,/allas/rendszerintegracios_mernok/CN-7864#adtype=dirCU,2023-02-13
40,Technical Process Specialist (REF705I),Budapest,Deutsche Telekom IT Solutions,/allas/technical_process_specialist_ref705i/LQ-6193#adtype=dirCU,2023-02-13
41,Szoftver tesztautomatizáló mérnök (biztonságkritikus diagnosztika),Budapest,Thyssenkrupp,/allas/szoftver_tesztautomatizalo_mernok_biztonsagkritikus_diagnosztika/OR-3573#adtype=dirCU,2023-02-13
42,Hardverfejlesztő mérnök (Veszprém),Veszprém,Thyssenkrupp,/allas/hardverfejleszto_mernok_veszprem/LV-3234#adtype=dirCU,2023-02-13
43,Experienced/Senior Data Engineer (REF1343L),Budapest,Deutsche Telekom IT Solutions,/allas/experiencedsenior_data_engineer_ref1343l/OH-5190#adtype=dirCU,2023-02-13
44,Medior/Senior Test Automation Engineer,Budapest,Randstad Hungary Kft,/allas/mediorsenior_test_automation_engineer/EU-9428#adtype=indCU,2023-02-13
45,Senior Project Manager (REF1450G),Budapest,Deutsche Telekom IT Solutions,/allas/senior_project_manager_ref1450g/PC-2441#adtype=dirCU,2023-02-13
46,AWS Data Architect - REF339V,Budapest,Deutsche Telekom IT Solutions,/allas/aws_data_architect_ref339v/RK-2748#adtype=dirCU,2023-02-13
47,Szerver és hálózat rendszeradminisztrátor - Server and Network administrator,Budapest,Randstad Hungary Kft,/allas/szerver_es_halozat_rendszeradminisztrator_server_and_network_administrator/EN-7790#adtype=indCU,2023-02-13
48,Azure Platform Engineer (REF62K),Budapest,Deutsche Telekom IT Solutions,/allas/azure_platform_engineer_ref62k/HA-8707#adtype=dirCU,2023-02-13
49,Gyakornok - adminisztratív feladatok (REF1517G),Budapest,Deutsche Telekom IT Solutions,/allas/gyakornok_adminisztrativ_feladatok_ref1517g/MP-5296#adtype=dirCU,2023-02-13
50,Software Engineer on network field (REF223C),Budapest,Deutsche Telekom IT Solutions,/allas/software_engineer_on_network_field_ref223c/FU-3899#adtype=dirCU,2023-02-13
51,Service Now Developer (REF86R),Budapest,Deutsche Telekom IT Solutions,/allas/service_now_developer_ref86r/WB-9031#adtype=dirCU,2023-02-13
52,Operations Manager EDI (REF513Z),Budapest,Deutsche Telekom IT Solutions,/allas/operations_manager_edi_ref513z/XQ-0736#adtype=dirCU,2023-02-13
53,"HARDWARE MÉRNÖK - FEJLESZTÉS, GYÁRTÁSTÁMOGATÁS (Pályakezdők jelentkezését is várjuk!)",Veszprém,IMPC Personnel Hungária Kft.,/allas/hardware_mernok_fejlesztes_gyartastamogatas_palyakezdok_jelentkezeset_is_varjuk/ID-6617#adtype=indCU,2023-02-13
54,Experienced Fullstack Developer (REF1022I),Budapest,Deutsche Telekom IT Solutions,/allas/experienced_fullstack_developer_ref1022i/RO-7878#adtype=dirCU,2023-02-13
55,Software Engineer (Java/Microservices) (REF274B),Budapest,Deutsche Telekom IT Solutions,/allas/software_engineer_javamicroservices_ref274b/DH-4297#adtype=dirCU,2023-02-13
56,Azure Platform Engineer (REF62K),Budapest,Deutsche Telekom IT Solutions,/allas/azure_platform_engineer_ref62k/JE-2329#adtype=dirCU,2023-02-13
57,Senior Network Architect (Open Telekom Cloud) - REF482J,Budapest,Deutsche Telekom IT Solutions,/allas/senior_network_architect_open_telekom_cloud_ref482j/ZM-2565#adtype=dirCU,2023-02-13
58,Szoftverintegrációs mérnök (automatizáció),Budapest,Thyssenkrupp,/allas/szoftverintegracios_mernok_automatizacio/YB-4620#adtype=dirCU,2023-02-13
59,Németül beszélő Customer Service Specialist (REF1256T),Debrecen,Deutsche Telekom IT Solutions,/allas/nemetul_beszelo_customer_service_specialist_ref1256t/IY-6912#adtype=dirCU,2023-02-13
60,Cloud Portal Developer (Microsoft Azure) (REF730S),Budapest,Deutsche Telekom IT Solutions,/allas/cloud_portal_developer_microsoft_azure_ref730s/RT-8375#adtype=dirCU,2023-02-13
61,Szoftver tesztautomatizáló mérnök (Veszprém),Veszprém,Thyssenkrupp,/allas/szoftver_tesztautomatizalo_mernok_veszprem/FR-4302#adtype=dirCU,2023-02-13
62,Cloud Engineer (Azure),Budapest,Randstad Hungary Kft,/allas/cloud_engineer_azure/NE-6705#adtype=indCU,2023-02-13
63,COGNOS expert (REF1469X),Budapest,Deutsche Telekom IT Solutions,/allas/cognos_expert_ref1469x/WI-2075#adtype=dirCU,2023-02-13
64,"Microsoft Application Administrator - Skype for Business, Teams (REF974Y)",Budapest,Deutsche Telekom IT Solutions,/allas/microsoft_application_administrator_skype_for_business_teams_ref974y/CM-8422#adtype=dirCU,2023-02-13
65,Application Administrator (Patch management) (REF1471N),Budapest,Deutsche Telekom IT Solutions,/allas/application_administrator_patch_management_ref1471n/US-0593#adtype=dirCU,2023-02-13
66,SAP Consultant (PP),Magyarország,Randstad Hungary Kft,/allas/sap_consultant_pp/GT-2966#adtype=indCU,2023-02-13
67,DevOps Engineer (VNI 1 NNA_ACC Squad) (REF220B),Budapest,Deutsche Telekom IT Solutions,/allas/devops_engineer_vni_1_nnaacc_squad_ref220b/QW-8639#adtype=dirCU,2023-02-13
68,Technical Process Specialist - Networking field (REF1481Y),Debrecen,Deutsche Telekom IT Solutions,/allas/technical_process_specialist_networking_field_ref1481y/GN-9083#adtype=dirCU,2023-02-13
69,Szoftverfejlesztési csapatvezető (Veszprém),Veszprém,Thyssenkrupp,/allas/szoftverfejlesztesi_csapatvezeto_veszprem/CW-8519#adtype=dirCU,2023-02-13
70,Rollout coordinator - automation - REF410H,Budapest,Deutsche Telekom IT Solutions,/allas/rollout_coordinator_automation_ref410h/DG-1412#adtype=dirCU,2023-02-13
71,DevOps Engineer (REF215M),Budapest,Deutsche Telekom IT Solutions,/allas/devops_engineer_ref215m/BK-2511#adtype=dirCU,2023-02-13
72,Operations Manager EDI (REF513Z),Budapest,Deutsche Telekom IT Solutions,/allas/operations_manager_edi_ref513z/EB-0348#adtype=dirCU,2023-02-13
73,Frontend fejlesztő (REF731J),Budapest,Deutsche Telekom IT Solutions,/allas/frontend_fejleszto_ref731j/RM-3344#adtype=dirCU,2023-02-13
74,Repl//MS Dynamics 365 Fejlesztő,Budapest,Deutsche Telekom IT Solutions,/allas/replms_dynamics_365_fejleszto/IP-9679#adtype=dirCU,2023-02-13
75,Senior Engineer Security and Forensics (OTC) - REF761L,Budapest,Deutsche Telekom IT Solutions,/allas/senior_engineer_security_and_forensics_otc_ref761l/ZT-2338#adtype=dirCU,2023-02-13
76,Technical Incident Manager (REF84R),Budapest,Deutsche Telekom IT Solutions,/allas/technical_incident_manager_ref84r/UO-7741#adtype=dirCU,2023-02-13
77,Szoftverfejlesztő mérnök - beágyazott rendszerekhez (Veszprém),Veszprém,Thyssenkrupp,/allas/szoftverfejleszto_mernok_beagyazott_rendszerekhez_veszprem/LW-8283#adtype=dirCU,2023-02-13
78,Alkalmazás üzemeltető Java fejlesztői tapasztalattal (REF984T),Budapest,Deutsche Telekom IT Solutions,/allas/alkalmazas_uzemelteto_java_fejlesztoi_tapasztalattal_ref984t/TO-6825#adtype=dirCU,2023-02-13
79,Cloud Architect in Azure Engineering - REF477J,Budapest,Deutsche Telekom IT Solutions,/allas/cloud_architect_in_azure_engineering_ref477j/QF-8811#adtype=dirCU,2023-02-13
80,DevOps Engineer,Magyarország,Deutsche Telekom IT Solutions,/allas/devops_engineer/QM-6475#adtype=dirCU,2023-02-13
81,Experienced Network Architect (REF245U),Budapest,Deutsche Telekom IT Solutions,/allas/experienced_network_architect_ref245u/UV-5681#adtype=dirCU,2023-02-13
82,"Tesztberendezés fejlesztő szoftvermérnök (labview, angol)",Veszprém,IMPC Personnel Hungária Kft.,/allas/tesztberendezes_fejleszto_szoftvermernok_labview_angol/KG-3206#adtype=indCU,2023-02-13
83,ABAP Developer,Budapest,Thyssenkrupp,/allas/abap_developer/UQ-6132#adtype=dirCU,2023-02-13
84,Technical Service Provisioner (REF708E),Budapest,Deutsche Telekom IT Solutions,/allas/technical_service_provisioner_ref708e/JS-2824#adtype=dirCU,2023-02-13
85,DevOps Engineer - Networking field (REF222U),Budapest,Deutsche Telekom IT Solutions,/allas/devops_engineer_networking_field_ref222u/QX-8461#adtype=dirCU,2023-02-13
86,Cloud Software Engineer (with .NET),Budapest,Randstad Hungary Kft,/allas/cloud_software_engineer_with_net/RP-2019#adtype=indCU,2023-02-13
87,Kubernetes Specialist (AWS) - REF141L,Budapest,Deutsche Telekom IT Solutions,/allas/kubernetes_specialist_aws_ref141l/VQ-4463#adtype=dirCU,2023-02-13
88,Java Szoftverfejlesztő (REF732W),Budapest,Deutsche Telekom IT Solutions,/allas/java_szoftverfejleszto_ref732w/BC-4371#adtype=dirCU,2023-02-13
89,Operation Manager Agile (PowerBI) (REF1406L),Budapest,Deutsche Telekom IT Solutions,/allas/operation_manager_agile_powerbi_ref1406l/SM-8390#adtype=dirCU,2023-02-13
90,DevOps Engineer-Optical Field (REF1457C),Budapest,Deutsche Telekom IT Solutions,/allas/devops_engineer_optical_field_ref1457c/UW-9883#adtype=dirCU,2023-02-13
91,Java Architect - Software Architect - PLM area (REF399Q),Budapest,Deutsche Telekom IT Solutions,/allas/java_architect_software_architect_plm_area_ref399q/FO-8944#adtype=dirCU,2023-02-13
92,NFT Tester (REF1042Y),Budapest,Deutsche Telekom IT Solutions,/allas/nft_tester_ref1042y/ZR-8534#adtype=dirCU,2023-02-13
93,Senior PLM / ALM Application Engineer,Budapest,Thyssenkrupp,/allas/senior_plm_alm_application_engineer/LO-1388#adtype=dirCU,2023-02-13
94,Alkalmazás üzemeltető német nyelvtudással (REF1340X),Budapest,Deutsche Telekom IT Solutions,/allas/alkalmazas_uzemelteto_nemet_nyelvtudassal_ref1340x/AF-9415#adtype=dirCU,2023-02-13
95,IT Architect for Software Engineering (REF1356U),Budapest,Deutsche Telekom IT Solutions,/allas/it_architect_for_software_engineering_ref1356u/UX-7586#adtype=dirCU,2023-02-13
96,SAP akadémia 2023 (REF1387G),Budapest,Deutsche Telekom IT Solutions,/allas/sap_akademia_2023_ref1387g/MC-6229#adtype=dirCU,2023-02-13
97,Service Delivery Manager (IT Security) (REF192G),Budapest,Deutsche Telekom IT Solutions,/allas/service_delivery_manager_it_security_ref192g/WM-8892#adtype=dirCU,2023-02-13
98,System Engineer - experienced (REF1324E),Budapest,Deutsche Telekom IT Solutions,/allas/system_engineer_experienced_ref1324e/HN-2238#adtype=dirCU,2023-02-13
99,Hardver és szoftver integrációs tesztmérnök,Budapest,Thyssenkrupp,/allas/hardver_es_szoftver_integracios_tesztmernok/MT-7400#adtype=dirCU,2023-02-13
100,DevOps Engineer EDG (TECHNIK HU/ VNI) (REF216Y),Budapest,Deutsche Telekom IT Solutions,/allas/devops_engineer_edg_technik_hu_vni_ref216y/KX-6038#adtype=dirCU,2023-02-13
101,BSS Tester (REF1034E),Budapest,Deutsche Telekom IT Solutions,/allas/bss_tester_ref1034e/GR-3465#adtype=dirCU,2023-02-13
102,Devops fejlesztő/üzemeltető (REF170P),Budapest,Deutsche Telekom IT Solutions,/allas/devops_fejlesztouzemelteto_ref170p/PQ-2556#adtype=dirCU,2023-02-13
103,Solution Engineer with DevOps (REF304U),Budapest,Deutsche Telekom IT Solutions,/allas/solution_engineer_with_devops_ref304u/ET-4565#adtype=dirCU,2023-02-13
104,Developer (REF1420Z),Budapest,Deutsche Telekom IT Solutions,/allas/developer_ref1420z/LX-2086#adtype=dirCU,2023-02-13
105,Application Administrator - Azure Operations Manager,Budapest,Deutsche Telekom IT Solutions,/allas/application_administrator_azure_operations_manager/DT-2012#adtype=dirCU,2023-02-13
106,Fullstack Developer - REF1483O,Budapest,Deutsche Telekom IT Solutions,/allas/fullstack_developer_ref1483o/OR-1809#adtype=dirCU,2023-02-13
107,AWS Consultant - REF343F,Budapest,Deutsche Telekom IT Solutions,/allas/aws_consultant_ref343f/DN-1229#adtype=dirCU,2023-02-13
108,Gyakornok Internal IT területre,Szeged,Deutsche Telekom IT Solutions,/allas/gyakornok_internal_it_teruletre/PW-0865#adtype=dirCU,2023-02-13
109,Hálózatépítő,Budapest,Randstad Hungary Kft,/allas/halozatepito/DN-1352#adtype=indCU,2023-02-13
110,Frontend Developer (Core media),Budapest,Deutsche Telekom IT Solutions,/allas/frontend_developer_core_media/ED-7746#adtype=dirCU,2023-02-13
111,Cloud Architect (Open Telecom Cloud) - REF1377P,Budapest,Deutsche Telekom IT Solutions,/allas/cloud_architect_open_telecom_cloud_ref1377p/ST-7825#adtype=dirCU,2023-02-13
112,Application Administrator Trainee,Budapest,Deutsche Telekom IT Solutions,/allas/application_administrator_trainee/LX-6230#adtype=dirCU,2023-02-13
113,Lead Java Developer (REF883E),Budapest,Deutsche Telekom IT Solutions,/allas/lead_java_developer_ref883e/JU-9127#adtype=dirCU,2023-02-13
114,Azure Migration Engineer - REF479F,Budapest,Deutsche Telekom IT Solutions,/allas/azure_migration_engineer_ref479f/GW-1203#adtype=dirCU,2023-02-13
115,Solution Engineer,Budapest,Deutsche Telekom IT Solutions,/allas/solution_engineer/CE-3644#adtype=dirCU,2023-02-13
116,Magenta View - Backend developer (REF1195A),Budapest,Deutsche Telekom IT Solutions,/allas/magenta_view_backend_developer_ref1195a/DZ-0136#adtype=dirCU,2023-02-13
117,Hardverfejlesztő mérnök,Budapest,Randstad Hungary Kft,/allas/hardverfejleszto_mernok/BX-9097#adtype=indCU,2023-02-13
118,Experienced report designer(REF681T),Budapest,Deutsche Telekom IT Solutions,/allas/experienced_report_designer_ref681t/PM-9702#adtype=dirCU,2023-02-13
119,DevOps Engineer,Budapest,Thyssenkrupp,/allas/devops_engineer/VS-1139#adtype=dirCU,2023-02-13
120,ServiceNow Business Analyst (REF189R),Budapest,Deutsche Telekom IT Solutions,/allas/servicenow_business_analyst_ref189r/RC-1218#adtype=dirCU,2023-02-13
121,Németül és angolul beszélő ügyfélkapcsolati munkatárs (REF1211K),Debrecen,Deutsche Telekom IT Solutions,/allas/nemetul_es_angolul_beszelo_ugyfelkapcsolati_munkatars_ref1211k/PR-3973#adtype=dirCU,2023-02-13
122,Junior Solution Engineer - Container Operation (REF942I),Budapest,Deutsche Telekom IT Solutions,/allas/junior_solution_engineer_container_operation_ref942i/HJ-6399#adtype=dirCU,2023-02-13
123,BI gyakornok (REF417C),Budapest,Deutsche Telekom IT Solutions,/allas/bi_gyakornok_ref417c/QH-5315#adtype=dirCU,2023-02-13
124,DevOps Engineer for Cloud of Things (REF542I),Budapest,Deutsche Telekom IT Solutions,/allas/devops_engineer_for_cloud_of_things_ref542i/SG-3825#adtype=dirCU,2023-02-13
125,Network engineer (Cisco),Budapest,Thyssenkrupp,/allas/network_engineer_cisco/BO-4310#adtype=dirCU,2023-02-13
126,Content developer in e-learning/Instructional designer - REF570E,Budapest,Deutsche Telekom IT Solutions,/allas/content_developer_in_e_learninginstructional_designer_ref570e/HQ-7803#adtype=dirCU,2023-02-13
127,Data Engineer for IoT (REF1449L),Budapest,Deutsche Telekom IT Solutions,/allas/data_engineer_for_iot_ref1449l/VC-0019#adtype=dirCU,2023-02-13
128,System project leader,Budapest,Thyssenkrupp,/allas/system_project_leader/HC-2675#adtype=dirCU,2023-02-13
129,Process and Service Management (REF125F),Budapest,Deutsche Telekom IT Solutions,/allas/process_and_service_management_ref125f/DT-0240#adtype=dirCU,2023-02-13
130,Szoftverintegrációs mérnök (automatizáció),Budapest,Thyssenkrupp,/allas/szoftverintegracios_mernok_automatizacio/OS-6695#adtype=dirCU,2023-02-13
131,German speaking IT Security Advisor (REF1513T),Budapest,Deutsche Telekom IT Solutions,/allas/german_speaking_it_security_advisor_ref1513t/TT-3847#adtype=dirCU,2023-02-13
132,Medior Java fejlesztő (REF1492A),Budapest,Deutsche Telekom IT Solutions,/allas/medior_java_fejleszto_ref1492a/WC-6373#adtype=dirCU,2023-02-13
133,Senior Frontend Developer,Budapest,Thyssenkrupp,/allas/senior_frontend_developer/RA-4075#adtype=dirCU,2023-02-13
134,Java Developer for Cloud of Things (REF521E),Budapest,Deutsche Telekom IT Solutions,/allas/java_developer_for_cloud_of_things_ref521e/SM-6874#adtype=dirCU,2023-02-13
135,Senior English speaking Scrum Master (REF1057S),Budapest,Deutsche Telekom IT Solutions,/allas/senior_english_speaking_scrum_master_ref1057s/TN-1310#adtype=dirCU,2023-02-13
136,Quality Manager - IT Software Development Project (REF1404I),Budapest,Deutsche Telekom IT Solutions,/allas/quality_manager_it_software_development_project_ref1404i/WD-0580#adtype=dirCU,2023-02-13
137,Application Support Engineer,Budapest,Thyssenkrupp,/allas/application_support_engineer/FE-4311#adtype=dirCU,2023-02-13
138,Technical Incident Manager (REF84R),Budapest,Deutsche Telekom IT Solutions,/allas/technical_incident_manager_ref84r/EK-7127#adtype=dirCU,2023-02-13
139,Process Manager - Software engineering (REF541Q),Budapest,Deutsche Telekom IT Solutions,/allas/process_manager_software_engineering_ref541q/SQ-6483#adtype=dirCU,2023-02-13
140,German and English Speaking Service Delivery Manager (IT Security) (REF1276Y),Budapest,Deutsche Telekom IT Solutions,/allas/german_and_english_speaking_service_delivery_manager_it_security_ref1276y/GM-0218#adtype=dirCU,2023-02-13
141,Alkalmazás üzemeltető Java fejlesztői tapasztalattal (REF984T),Debrecen,Deutsche Telekom IT Solutions,/allas/alkalmazas_uzemelteto_java_fejlesztoi_tapasztalattal_ref984t/MB-3010#adtype=dirCU,2023-02-13
142,"Microsoft Application Administrator - Skype for Business, Teams (REF974Y)",Budapest,Deutsche Telekom IT Solutions,/allas/microsoft_application_administrator_skype_for_business_teams_ref974y/JS-5858#adtype=dirCU,2023-02-13
143,Developer (REF1307I),Budapest,Deutsche Telekom IT Solutions,/allas/developer_ref1307i/KB-1388#adtype=dirCU,2023-02-13
144,Safety Manager,Budapest,Thyssenkrupp,/allas/safety_manager/XR-1211#adtype=dirCU,2023-02-13
145,Cloud Engineer - Linux (REF1144J),Budapest,Deutsche Telekom IT Solutions,/allas/cloud_engineer_linux_ref1144j/LU-5902#adtype=dirCU,2023-02-13
146,Hardverfejlesztési folyamatgazda,Budapest,Thyssenkrupp,/allas/hardverfejlesztesi_folyamatgazda/XZ-5477#adtype=dirCU,2023-02-13
147,Cyber Security Analyst Tier2 (REF196L),Budapest,Deutsche Telekom IT Solutions,/allas/cyber_security_analyst_tier2_ref196l/BP-8726#adtype=dirCU,2023-02-13
148,Technical Product Manager for HR projects - REF1494J,Budapest,Deutsche Telekom IT Solutions,/allas/technical_product_manager_for_hr_projects_ref1494j/IM-0047#adtype=dirCU,2023-02-13
149,Automotive üzemeltető (Alkalmazás üzemeltető) (REF920M),Budapest,Deutsche Telekom IT Solutions,/allas/automotive_uzemelteto_alkalmazas_uzemelteto_ref920m/TI-9977#adtype=dirCU,2023-02-13
150,DevOps Engineer EDG (TECHNIK HU/ VNI) (REF216Y),Budapest,Deutsche Telekom IT Solutions,/allas/devops_engineer_edg_technik_hu_vni_ref216y/KU-3923#adtype=dirCU,2023-02-13
151,API Developer (REF1084X),Budapest,Deutsche Telekom IT Solutions,/allas/api_developer_ref1084x/IG-5281#adtype=dirCU,2023-02-13
152,Software Engineer in networking Lab enviroment (TC Core/Technik HU) (REF225Q),Budapest,Deutsche Telekom IT Solutions,/allas/software_engineer_in_networking_lab_enviroment_tc_coretechnik_hu_ref225q/AO-3733#adtype=dirCU,2023-02-13
153,AWS Architect - REF341L,Budapest,Deutsche Telekom IT Solutions,/allas/aws_architect_ref341l/KG-7116#adtype=dirCU,2023-02-13
154,Lead Incident Manager - experienced (REF1210J),Budapest,Deutsche Telekom IT Solutions,/allas/lead_incident_manager_experienced_ref1210j/PR-8633#adtype=dirCU,2023-02-13
155,Automation Developer – Migration area,Budapest,Deutsche Telekom IT Solutions,/allas/automation_developer_migration_area/SL-9949#adtype=dirCU,2023-02-13
156,Change Manager (REF1395D) - German and English Speaking,Budapest,Deutsche Telekom IT Solutions,/allas/change_manager_ref1395d_german_and_english_speaking/VR-7087#adtype=dirCU,2023-02-13
157,Technical Process Specialist - Networking field (REF1481Y),Debrecen,Deutsche Telekom IT Solutions,/allas/technical_process_specialist_networking_field_ref1481y/LC-6755#adtype=dirCU,2023-02-13
158,Szoftvertesztelő (experienced/senior) angol nyelvtudással (REF1392I),Budapest,Deutsche Telekom IT Solutions,/allas/szoftvertesztelo_experiencedsenior_angol_nyelvtudassal_ref1392i/FE-3567#adtype=dirCU,2023-02-13
159,Machine Learning Operations (MLOps) Engineer (REF692A),Budapest,Deutsche Telekom IT Solutions,/allas/machine_learning_operations_mlops_engineer_ref692a/DQ-9012#adtype=dirCU,2023-02-13
160,Cloud Architect (REF891C),Budapest,Deutsche Telekom IT Solutions,/allas/cloud_architect_ref891c/DO-4566#adtype=dirCU,2023-02-13
161,Software Developer (Core Media) (REF273X),Budapest,Deutsche Telekom IT Solutions,/allas/software_developer_core_media_ref273x/BX-7484#adtype=dirCU,2023-02-13
162,IT specialista vagyok és a DT-ITS-nél szeretnék dolgozni,Budapest,Deutsche Telekom IT Solutions,/allas/it_specialista_vagyok_es_a_dt_its_nel_szeretnek_dolgozni/CD-3362#adtype=dirCU,2023-02-13
163,Solution Engineer - SD-WAN (REF1496Z),Budapest,Deutsche Telekom IT Solutions,/allas/solution_engineer_sd_wan_ref1496z/MG-2442#adtype=dirCU,2023-02-13
164,Senior alkalmazás üzemeltető - Mainframe (REF121Q),Budapest,Deutsche Telekom IT Solutions,/allas/senior_alkalmazas_uzemelteto_mainframe_ref121q/FJ-8258#adtype=dirCU,2023-02-13
